num,title,rating(10),review
1,Green Book (2018),8,A journey of reawakening in a Country like ours - Gore Vidal called it the United States Of Amnesia - the absurdity of the behavior in the Southern communities even the kindest ones have a jarring effect. Viggo Mortensen is sheer perfection as the all American Italian. The opening of his heart and of his mind is a total joy and Mahershala Ali provides another magnetic character to his already rich list of magnetic characters but what makes this film fly so high is the humanity that Mortensen and Ali infuse their characters with. I loved them and Green Book provided me with one of the most satisfying endings of 2018. It leaves you with the hopeful thought that perhaps we're not there yet but that we are on our way. Happy New Year!
2,Green Book (2018),10,"We loved Green Book along with the sold-out crowd who applauded loudly at the end. Based on true story of piano virtuoso, Don Shirley's road trip through the south during the 60's, the film pays tribute to his genius and courage as a black man who tries hard to soar above the ugliness of the times. The elegant trappings of his home and his success as a concert pianist leave him arrogantly cold and lonely, but his life begins to change when he hires Tony as his road trip driver. With a history as nightclub bouncer with Mafia connections in New York, Tony is the antithesis of Don's perfection and their evolving relationship on the road makes the movie soar above the ordinary and become magical. Viggo and Ali in the main roles are remarkable, and it's funny and endearing to watch them discard stereotypes and discover their mutual humanity. What we liked best is the movie teaches without preaching, it all unfolds through a myriad of natural moments between two great actors and a strong supporting cast. Top all this off with a really good soundtrack, excellent direction and production values, and an audience that laughed out loud and vigorously applauded at the end...this one is a true 10!"
3,Green Book (2018),10,"I saw Don Shirley perform in college in 1966. At the time I simply thought he was a hell of a pianist, using that bass and cello to come up with a unique sound. So when this movie came along, I thought ""I saw that guy!"" I know the critics are being hard on this film, but I sat for two hours, totally captivated. I know there are stereotypes. Could that be because the repeated actions against minorities and the actions of racists have become so commonplace they seem like stereotypes. I believe the performances of these two fine actor made the show. There is a subtlety to this movie that transcends many others of its type. Yes, there are Southern cops; yes, there are men's rooms that are off limits; yes, there are simplistic views of racism by white New Yorkers. But what I got was a realistic presentation of an evolving friendship. Shirley is abrasive and self-centered; Lip is clueless most of the time. And I believed in them. See this film."
4,Green Book (2018),9,"I saw this at the premier at TIFF and was thrilled to learn the story is about a real friendship. This is not a typical road movie, or buddy film. Given the lead actors, I knew it would be something special, and it is. Entertaining, funny in parts, hard to accept in others - as a white american who wasn't around in the 1960's, the racism was mind boggling and I couldn't help but feel shame. Green Book has so many layers - family, culture, honesty, dignity, genius, respect, acceptance, stereotypes, racism, music, class, friendship, and fried chicken. Whatever your views, race, or age - this film is not 'preachy', but you should appreciate an honest portrayal of a difficult time & place in history. I'll use the term an ""unlikely friendship"", but knowing the two men were real makes it fantastic. I'm so grateful to have learned about them and their lives. I only wish there had been a Q&A afterward."
5,Green Book (2018),10,"Green Book is a wonderful story of overcoming self-condemnation, and the resulting freedom it provides. As the film begins, Tony is locked in a prison of judgment and rejection, not from any conscious effort on his own but rather his circumstances and environment. As the self-assured and self-aware character of Dr. Shirley is introduced into Tony's life, Tony embarks on a journey of self-discovery in which he is forced to confront his own preconceived notions which ultimately stem from his skewed view of himself. As Dr. Shirley helps Tony to see himself as a man beyond his own limiting thoughts, Tony is finally able to step into his true nature as friend to Dr. Shirley. Everywhere in this film we are reminded that people are complicated, but beyond these complications we are also reminded that everyone is the same, just looking for love and acceptance. The scene where Dolores reads Tony's letter to her cousins is spectacular in this regard. It's interesting that none of the other reviews mention the YMCA scene and aftermath, which for me was the pinnacle moment that the power shifted for these two characters confronting their own strengths and weaknesses. This film is simply wonderful in its portrayal of humanity, and the people we need in our lives. While it comes to light that Tony's wife Dolores is completely aware of her husband's imperfections and shortcomings, she loves him just the same. But it is confrontation, not love, that is necessary to bring about Tony's redemption, demonstrating that the people who spur us to deep, personal growth are never who or what we expect."
6,Green Book (2018),10,"This picture should be up for BEST PICTURE. It has everything: great acting, solid script-writing (something that Hollywood really needs), and lots of humor. I wish that Hollywood would make more pictures like this."
7,Green Book (2018),9,"Some of my movie friends were stunned when I mentioned in a thread that this was my ""People's Choice Award"" vote for TIFF 2018 (it won, btw). I generally go for weightier fare, so my being won over by a PG-13 road film with the familiar ""they-couldn't-have-been-more-different"" premise directed by the auteur co-responsible for such recent classics as ""Dumb and Dumber To"" and ""The Three Stooges"" elicited a virtual double-take.

But I couldn't help it ... it really WAS the best film I saw (out of 17), and far and away the most entertaining. I think this is largely because it's based on a real-life story about the beginning of a lifelong friendship - a story that has writing participation by the son of one of the real-life characters. There's definitely an air of authenticity to the events as they unfold that could never occur with a purely contrived plot. Consider: A college-educated concert pianist of Jamaican descent hires a temporarily-unemployed Italian-American nightclub bouncer who's streetwise but academically dim to drive him to venues in the Deep South back in 1962. That's not a setup that a Hollywood script written from scratch would ever have come up with.

The two lead actors really click. Mahershala Ali makes a nice Oscar follow-up playing the aloof pianist passenger to Viggo Mortensen's ""b.s. artist"" driver. Ali is certain to get another nomination; Mortensen's performance may be a little too broad to garner one, but he delivers exactly what's called for. And he makes a believable Italian-American, which is impressive considering that he's Danish.

I'm allergic to preaching and heavy-handedness in movies no matter what the message, and with the exception of one borderline scene, I'd say that the movie nicely sidesteps these proclivities that surface so often in socially-conscious films.

The music and FX are excellent. When an actor plays a piano player, there's always the challenge of making the playing look believable. It doesn't get any better than it gets here - Ali's piano playing is every bit as convincing as Margot Robbie's ice skating in I, TONYA. You never see a disconnect between hands and body as he's filmed against a variety of backgrounds. And if I could bet on an Oscar win right now, it would be Kris Bowers for Best Original Score. (He also supplies Ali's hands, which should clinch it.)

Top everything off with a Capra-esque Christmas Eve finale and a closing line that sends everyone home smiling, and it all adds up to a monster hit. Its commercial payoff could be huge - the movie practically begs for a TV series spinoff, and the real-life characters remained friends until they both died in 2013.

So congratulations to Peter Farrelly on his graduation from co-directing lowbrow fare to solo-directing middlebrow (i.e. mass-appeal) fare. You can't deny the talent and craftsmanship it takes to make a mainstream movie that works as well as this one does."
8,Green Book (2018),7,"... just that it's so inoffensive, safe, and cliche that I feel like I've seen it a million times before. Mortensen and Ali are terrific actors, and I am thankful for them. Without their charisma (and Viggo's willingness to shove insane amounts of food down his throat), I fear Green Book would be dead on arrival.

Mostly, I think this is a movie that's desperately afraid of 'offending' anyone. For instance: if there's a scene with racist cops, there will also be a scene with a good cop down the road, just to make clear that the movie is not stating or suggesting that 'all cops are/were racist'. It's also funny that the good-cop scene happens in the snow, to let us know the characters are back in a blue state, where supposedly life wasn't so bad for a black man after all! This is one of the many simplistic moves that indicate to me that the filmmakers were willing to sacrifice the complexities of their themes for a feel-good entertainment.

The script wants both characters to 'learn' from each other and eventually change and grow, but to make this happen, it turns them into unrealistic caricatures. It's a bit frightening how Shirley is portrayed as a complete ignorant of black culture, but it had to be this way so Tony can be the one to 'introduce' him to it. Tony's transformation comes simply from witnessing racism first hand, as if he never experienced such a thing in his life before - maybe another consequence of this being a blue state-red state movie??

So besides the performances, that speak for themselves, I think it's a very uninspired effort. At one point the characters leave the car for no reason other than to have a dramatic confrontation in the rain, as if rainy night equals 'dramatic weight'. I saw it in a packed movie theater and people seemed to enjoy it. You can't blame them. The movie has a 'now everything's fine' conclusion that can leave audiences in a good state of mind - but it also shows how simplistic it really is."
9,Green Book (2018),10,I saw this at TIFF and loved it from beginning to end. It's a moving true story about two people who forge an unlikely friendship. Thought-provoking but never preachy.
10,Green Book (2018),8,"Outstanding true story film showing that color doesn't define us, but how we act ourselves and towards others, does.

Great performances from the entire cast, especially Viggo Mortensen and Mahershala Ali who were perfectly cast and convincing in their roles. It was also great to see comedian Sebastian Maniscalco in this film as well.

Writer, director and producer Peter Farrelly nailed every aspect of this biography.

The score, cinematography, sets and visuals were all on point.

I'm not a fan of slow paced long films, but this was was close to an exception. I feel if the pace was picked up a bit and/or the 130 min run-time edited down to around 110 mins, this would have been a perfect 10 from me.

Excellent drama and comedy perfectly positioned throughout the film.

A well deserved 8/10 from me."
11,Green Book (2018),10,"Who could've ever greenlit ""Green Book""? A (mostly) true story of two men of completely different backgrounds overcoming their own prejudices and the stifling racism of the Deep South of the early 1960s. We'll hire a Danish guy to play an Italian guy, and a guy best known for playing a political fixer and a dope dealer (in ""House of Cards"" and ""Moonlight"", respectively) to play a Jamaican-American musical genius. And we'll have one of the Farrelly brothers direct it. How could that possibly become a great movie? Well, it does- primarily through the great performances of Viggo Jorgensen and Mahershala Ali, and the nuanced directing of Peter Farrelly. It confronts the racism prevalent at the time without becoming preachy, and shows its main characters growing through contact with each other, without a complete reversal of their characters (which would've seemed phony). Oh, and the movie looks great, too- the period cars, sets, and costumes really take you back to that time period. A film festival favorite, ""Green Book"" will hopefully be appreciated by Oscar voters, too."
12,Green Book (2018),9,"A very inspiring film. I walked out of the cinema feeling like there is good even in the unlikeliest of people. The dialogue was well written, and the main characters were equally as loveable. Viggo Mortensens acting was only overshadowed by that of Mahershala Ali, whose portrayal of an educated african-american man living in 1960's america was both heartwrenching and absolutely hilarious. While Mortensen stood for most of the comic relief, I found myself laughing the hardest from Ali's deadpan deliveries through the character of Dr. Shirley.

The story of a black man who struggles to gain the respect of his fellow african-americans, while simultaneously resisting and pulling at the roots of the racism and oppression which keeps him from being as successful as the americans and europeans who should be his equals by all measures musical and educational.

While the story and plot left little to be desired. I felt one or two jokes were shoe-horned in and would have been better discarded. The visual tone was fitting to the film, but the camerawork was nothing out of the ordinary. Not all films call for out-of-this-world originality in all marks however. And this film allows the audience to focus on what is really important."
13,Green Book (2018),10,"I saw this film in a preview here in Calgary.

I've seen Mortensen in films before and thought he was an okay film actor. His embodiment of Tony Lip is totally immersive. I not only believe his Bronx character, but depiction of Tony's growth as a human being is remarkable to watch. I can't say enough about Ali's performance as Don Shirley. It is nuanced and impressive.

Watching these two characters interact and change each other is fascinating. This isn't just another road-trip buddy movie. It is funny, it is poignant and it is a brilliantly written and crafted film.

The only drawback is, you will have to wait until US Thanksgiving to see it."
14,Green Book (2018),6,As a light-weight feel good film it works. However if you go into the cinema expecting something a bit more substantial then be prepared for disappointment. The biggest negarive for me was the fact that it is such a predictable movie. Without seeing it I could have written an accurate synopsis based soley on the premise. Definitely overrated for the cinema but ok if you want something easy on the brain at home on a Sunday evening.
15,Green Book (2018),9,"Just caught this as the surprise film of the London Film Festival. Such a well written drama with heart, soul and comedic touches, brilliantly performed by the two main actors, and given such an authentic 1962 shiny look to the film by the production designer and cinematographer. A truly great true story with themes that all audiences can connect with - namely, music, family, race, sexuality, friendship and love - and Viggo Mortensen probably gives the performance of a lifetime. Will surely rival A Star is Born at the Oscars in many of the same categories."
16,Green Book (2018),7,"Right off the bat I want to say that I thoroughly enjoyed this movie.the cinematography was beautiful with such rich color pallets. The score was wonderful and set the tone very well. Lastly the acting was incredible. Viggo and Ali shined in their roles and did a great job at portraying their characters.

That said, in my mind the movie was nothing special. It was all very predictable and had a very similar feel to many other civil rights movies in which a black man and a white man start off the movie with a reluctant relationship and slowly warm up to each other as they begin to appreciate their similarities and eachothers troubles and eventually defy all social norms and become good friends. I'm not saying that they shouldn't have become friends because you can't rewrite history and this movie was based on a true story. I just wish that story telling was a bit more ambitious and delved into some of the ideas deeper rather thank making a well made but otherwise mediocre civil rights movie."
17,Green Book (2018),10,"One of the reasons why I love this movie is simply because we are soooo much more. We as ""Black"" people have rich, intriguing, moving, and funny stories-I hate that we are sitting around waiting for the Next Great Director make movies in which the narratives do more than entertain. I hope Tyler Perry would be one of those innovative directors, but now I don't care who tells it-as long as it gets told. Thank you to the writer and director for such a moving movie that touches more than my funny bone."
18,Green Book (2018),10,"This movie has it all......it's a true story done just right. The audience clapped and clapped when the movie ended and no one got up until the last credit rolled. It's hard to believe that this was 1962 and even more frightening to think that some of the behaviors in the movie are being duplicated today in this country. It's a movie that is worth seeing again and again, it's that good and realistic."
19,Green Book (2018),4,"There is nothing new in Green Book. The same story has been told many times by the Hollywood propaganda machine - improbable interracial friendships where the black man has to do all the emotional heavylifting in order to make our white protagonist slightly less racist. This ""friendship"" is ultimately portrayed as a mutual exchange of perspectives, where both sides manage to find common grounds with each other and come to understand their shared humanity.

This is the archetype of the liberal humanist narrative, where power structures are conveniently ignored, and where political oppression and economic exploitation is reframed as nothing more than differences in culture and perspectives. As a result, according to this ideological narrative, the purpose of (liberal democratic) politics is reconciliation and compromise, as opposed to struggling for emancipation. The problems of structural violence and economic exploitation is reframed as individual prejudice and actions, which can be changed by respectability politics (""they go low, we go high"") and this bland humanist appeal to the oppressor's conscience.

This is the deeply ideological narrative of Green Book and countless other stories, from Driving Miss Daisy (1989) to The Green Mile (1999) to Gran Torino (2008) to The Help (2011), where the real problem - the irreducibly structural problem - is always erased in favor of a feel-good humanist drama that appeals primarily to middle-class white guilt. Year after year, middle-class white audience can walk out of these Hollywood films with a smug face, complacently declaring that they're glad that ""racism is finally over.""

Many people defend this film by saying that there's nothing inherently wrong with a comedic and light-hearted approach to serious social and historical problems. What they're saying is not wrong. In fact, some of the greatest works of cinema (and art in general) is about people finding humor and spirit in extreme positions of subjugation and poverty. Yet these artworks depict poverty and oppression with acute social awareness and compassion, instead of flattening them into bland archetypes or straight-up ignoring them, which is what Green Book is guilty of.

Here we have two characters - an educated upper-class black man who is completely isolated from the culture and social conditions of his people, and a racist working-class white man who is portrayed as a misguided good-hearted person. The class dimension is never explicitly challenged or fully confronted, especially Don's bourgeois sensibility. Instead, the film focuses on how the two can learn from each other and become better persons - Don becoming more down-to-earth and in touch with black popular music, and Tony becoming less racist. Yet the film never backs down from its pedagogy of respectability politics and never challenges its narrative of black exceptionalism. What does the film ultimately show about Don and Tony's friendship? It shows that only an exceptional, upper-class, respectable, talented black man can change the racist attitude of a white working-class man, and the film invites the audience to participate in its complacency, its classism, and its outrageous reductionism.

The problem is not the humorous approach, but the absolutely reactionary myths about racism and racists that are perpetuated in this film, and the bourgeois complacency that this film engenders, which does nothing but reinforce the continued whitewashing and cooptation of the civil rights strategy, and the perpetuation of assimilationism, respectability politics, and reconciliationism."
20,Green Book (2018),10,"This film's core thought and social issues are obviously embodied by the African American pianist Don Shirley (Mahershala Ali) who educated at USSR and hires a Italian-American bouncer Tony Vallelonga (Viggo Mortensen) as his driver/ assistant for musical performance tour across the continent of US from the north (N.Y.City) to the south (Birmingham, Alabama) in post war era.

Two social issues are concerned here rather than the lack of literacy of the working class protagonist Tony. One is class relationship of the capitalist class and the working class; the other one is that the African origin and the Caucasian.

The family relationship (loneliness caused by Tony's tour assistant job which has an emotional effect between both Tony and his wife) is something additional to this core social issues concerned in this film.

Among all the locations they traveled, I personally familiar with Louisville, KY where the famous Muhammad Ali (1942-2016) lived as a hometown, KFC also headquartered in that town.

When Toni enjoys KFC fried chickens and throws its born and a coke away from the car window during driving on the town road, we can clearly know his disgusting bad behaviour that makes working class look like a bit unenlightened. It also makes us uncomfortable while seeing the film.

However, the fight scene in the bar at that town is a resemblance to what had happened to Muhammad Ali during his earlier age in Louisville that he was refused from entering a restaurant in that way.

Besides this, the abusive Caucasian police officers falsely flag and arrest Don and Tony at sundown town during car driving on the rainy day. This kind of racist tendency is also a typical everyday scene in the American society.

A capitalist/African American pianist Don teaches illiterate Tony during his job on the tour to help him sending far better written letters to his wife as a sign of Tony's personal development and improvement of his disgusting behaves.

The most tensioned moment of this film is when Don refuses to do the final performance after he gets discriminated by the conservative racist restaurant manager from entering the place for a dinner.

His brave decision to break the deal under such awkward business occasion is nether for the business profit nor reputation but it is for protecting his human dignity. Remember making a decision is an essence of plotting and the entire story telling to express something important and identifiable for audiences and society in general.



Of course, the film is not a far left class war stuff, it is ordinarily intended to harmonise both racial difference and class conflict with such happy ending. The entire framework of film construction is a typical capitalist one."
21,Green Book (2018),10,"This movie is not only smart and funny, it is incredibly watchable and enjoyable. The cars, the food, the clothes, the background music, the piano playing, the faces and voices of the character actors -- not a dull frame.

To story, writing, directing -- This movie avoided the traps that road-trip buddy movies faceplant into. Scenes that easily could have been trite and corny were fresh and sharp. No punches pulled, people ground into the dirt and resurrected by sheer strength of will. Some of the events were so painful and unsparing that I had no idea how the movie would end.

Another big thing, the movie wasn't cynical despite some of the ugliness it reveals. Faith, family, honor, are all part of the movie without being in your face. You'll fall in love with the characters."
