num,title,rating(10),review
22,Green Book (2018),3,"I had high expectations based on the positive reviews but was quite disappointed.

The story had a good potential to explore a relationship between a sophisticated black pianist who employs a white working class driver as they travel through the US south in the sixties. They have seemingly nothing in common, from the way they were brought up, the way they speak and eat, their family backgrounds and financial situations, their way of treating other people. As they spend time together on the road trip, they start to appreciate each other and learn from each other.

What bothered me was that the characters ended up being caricatures instead of being believable. The film tries to depict their differences to the point that it did not make sense. For example, we are supposed to believe that a black musical genius pianist never heard of Aretha Franklin or Little Richard? Or that he never tried fried chicken? I also thought that Viggo Mortensen was slightly over-acting.... The racial problems were not depicted in an authentic way.

The movie just received an Oscar nomination for Best Picture, likely because of the social commentary and not because of great film-making."
23,Green Book (2018),10,"The film, from which at first did not expect delight. The film, behind the ease of irony which hides a deep meaning. A film that you watch without stopping, although this is far from a blockbuster that you have been waiting for for years. It's all about Peter Farinelli's Green Book.

The plot tells of a journey through the southern states of a talented black pianist (Mahershala Ali) and his bouncer driver, hired solely for this tour (Viggo Mortenessen). Minor at first sight and a little bydlovaty hero Mortensen during this uncomplicated journey becomes for an esthete pianist a true friend, support and even a treasure of useful knowledge about life and society, and he draws from the boss useful skills in aesthetics, love of art and good parenting.

The plot is very simple, the film looks incredibly easy. Dialogues are written ironically, absolutely not boring, but at the same time they remain filled with meaning for the viewer. The relationship between the characters is the main motive of the film. And how could so different people in all respects be able to become each other friends for life in a few weeks?

It should be noted that the leitmotif of 'racism', which at that time was still extremely common in America, especially in the south, was incredibly subtly written. All these hotels are for 'colored', individual cafes, pools and even latrines .. the nuances of that time in the film are shown perfectly, and so that you yourself feel ashamed that this existed. I literally wanted to stand up and give the characters in the face in several scenes.

Surprisingly, the director Peter Farinelli had previously shot mostly comedies (and mostly with his brother), and this is his first film in the comedy drama genre. From my point of view, he handled it perfectly and I would love to see what else he would film later, although I can't say before that I set him apart as an interesting director. Perhaps it was the fact that the film was made only by Peter Farenelli very strongly contributed to the 'nobility' of the picture in terms of humor.

The funny fact is that one of the screenwriters of the film is Nick Vallelonga, his father was the prototype of the main character Frank (Tony Chatterun) Vallelonga. The script was written on the basis of dictation records made by Nick Vallelonga. Later on these records, Viggo Mortensen learns to speak Italian, because his hero is Italian.

The film was shot in the spirit of the 60s, beautiful cars of that time are very well shown, the art of the costume, the receptions in the large houses of the rich public (some 'Gone with the Wind' is immediately remembered)

This film is simple, kind, sincere. Without any strain, without life horrors, you know, where someone dies, someone is killed or someone is in prison. The atmosphere of the film is ""soft"" and light. You literally find yourself in this time, with terrific cars of all colors of the rainbow, men in flawless day costumes of all colors, gentlemen with whiskey at the bar in hotels listening to the brilliant pianist.

The Green Book is not a picture of slavery, racism and humiliation, although it touches on these topics. The Green Book is a film about honesty, human dignity, true friendship and mutual support between people. The film is about the fact that it is very difficult to change the ingrained thinking of society alone, even if you are brilliant and famous.

By viewing required."
24,Green Book (2018),10,"I was fortunate enough to see this at a Directors Guild Screening last night. Wow!! Characters, dialogue, sets, costumes, cars..... really transported me to an era I had not experienced. I was sad when the movie ended... the mark of a great film. The scene with the fried chicken in the car was priceless. I could watch it 1000 times.I sense oscar nods for Mahershala Ali, Viggo Mortensen, art department, costumes, writer(s) and director. Absolutely amazing..... Do not hesisitate to see this!!!"
25,Green Book (2018),3,"How did this film even get considered for an Oscar? This is low grade pap, unchallenging, unbeleivable, dull and so cliched its difficult to believe a fine actor like Mortensen would get involved. And why cast a Scandinavian as a Bronx Italian? Mahershala Ali has done himself no favours either creating a cartoonish 'sophisticate', though the hand doubling during his piano playing was impressive. This is heavy handed populism, shallow and self-righteously preaching, reducing a complex social struggle to simple stereotypes. The cinema landscape of 2018 must be very lacking for this to be lauded as it is. But then in reality it is not, with Masterpieces like Roma on display, its just that the Oscars is not really as important as it would like to be."